<project name="my-app" stack="nextjs" version="0.1.0"
         xmlns:xsi="http://www.w3.org/2001/XMLSchema-instance"
         xsi:noNamespaceSchemaLocation="pxml.xsd">
  <import src="./flows/blog.xml" as="blog" />

  <node id="setup.nextjs" type="setup-command" flow="setup">
    <meta>
      <path>package.json</path>
    </meta>
    <constraint verify="static">Initialize Next.js app in the current directory non-interactively. Run: npx create-next-app@latest . --typescript --eslint --tailwind --app --no-src-dir --import-alias "@/*" --use-npm --yes && npm install better-sqlite3 && npm install --save-dev @types/better-sqlite3</constraint>
  </node>

  <node id="ui.home" type="ui-component" flow="navigation">
    <meta>
      <path>app/page.tsx</path>
      <depends_on>setup.nextjs</depends_on>
    </meta>
    <constraint verify="static">Replace the entire homepage with a beautifully styled landing page (clean dark theme, tailwind classes). Do not call any dashboard APIs like /api/network or /api/ram. Show a hero section, and a prominent link/button pointing to the Posts page at '/posts'.</constraint>
  </node>
</project>
